### ISSUE TITLE
TRex can generate packets with TCP payload greater than agreed MSS for IPv6 traffic

### ISSUE THREAD

**Issue by darrentodd** [cisco-system-traffic-generator/trex-core#344]
TRex can generate packets with TCP payload greater than agreed MSS - reference Google Group thread https://groups.google.com/forum/#!topic/trex-tgn/sXhysk3oR-o - with IPv6 flows I see packets being dropped at my DUT:

The DUT talking server side to TRex sends SYN with MSS of 1440 here;

```
Frame 549: 94 bytes on wire (752 bits), 94 bytes captured (752 bits)
Ethernet II, Src: c2:e8:86:66:06:c0 (c2:e8:86:66:06:c0), Dst: IntelCor_20:99:28 (a0:36:9f:20:99:28)
Internet Protocol Version 6, Src: ::16.0.128.53, Dst: ::48.0.128.56
Transmission Control Protocol, Src Port: 17441, Dst Port: 80, Seq: 0, Len: 0
    Source Port: 17441
    Destination Port: 80
    [Stream index: 44]
    [TCP Segment Len: 0]
    Sequence number: 0    (relative sequence number)
    [Next sequence number: 0    (relative sequence number)]
    Acknowledgment number: 0
    1010 .... = Header Length: 40 bytes (10)
    Flags: 0x002 (SYN)
    Window size value: 43200
    [Calculated window size: 43200]
    Checksum: 0xad36 [unverified]
    [Checksum Status: Unverified]
    Urgent pointer: 0
    Options: (20 bytes), Maximum segment size, SACK permitted, Timestamps, No-Operation (NOP), Window scale
        TCP Option - Maximum segment size: 1440 bytes
            Kind: Maximum Segment Size (2)
            Length: 4
            MSS Value: 1440
        TCP Option - SACK permitted
        TCP Option - Timestamps: TSval 1501722585, TSecr 0
        TCP Option - No-Operation (NOP)
        TCP Option - Window scale: 12 (multiply by 4096)
    [Timestamps]
```

But some data packets are being sent from TRex that are 1448 bytes in size; ie doing network capture from TRex side I see this packet being sent as 1534 bytes on the wire & 1448 bytes as TCP payload:

```
Frame 556: 1534 bytes on wire (12272 bits), 1534 bytes captured (12272 bits)
Ethernet II, Src: IntelCor_20:99:28 (a0:36:9f:20:99:28), Dst: c2:e8:86:66:06:c0 (c2:e8:86:66:06:c0)
Internet Protocol Version 6, Src: ::48.0.128.56, Dst: ::16.0.128.53
Transmission Control Protocol, Src Port: 80, Dst Port: 17441, Seq: 696, Ack: 1592, Len: 1448
    Source Port: 80
    Destination Port: 17441
    [Stream index: 44]
    [TCP Segment Len: 1448]
    Sequence number: 696    (relative sequence number)
    [Next sequence number: 2144    (relative sequence number)]
    Acknowledgment number: 1592    (relative ack number)
    1000 .... = Header Length: 32 bytes (8)
    Flags: 0x010 (ACK)
    Window size value: 32768
    [Calculated window size: 32768]
    [Window size scaling factor: 1]
    Checksum: 0x463c [unverified]
    [Checksum Status: Unverified]
    Urgent pointer: 0
    Options: (12 bytes), No-Operation (NOP), No-Operation (NOP), Timestamps
    [SEQ/ACK analysis]
    [Timestamps]
    TCP payload (1448 bytes)
    [Reassembled PDU in frame: 564]
    TCP segment data (1448 bytes)
```

Workaround for this is to drop the MSS value in the glob_info object ie:

```
        #set the MSS values lower
        c_glob_info = ASTFGlobalInfo()
        c_glob_info.tcp.mss = 1400
        s_glob_info = ASTFGlobalInfo()
        s_glob_info.tcp.mss = 1400

        # profile
        profile = ASTFProfile(default_ip_gen=ip_gen, default_c_glob_info=c_glob_info, default_s_glob_info=s_glob_info,
```

Thanks,
Darren
